{
  "design_route": "single_time_observational",
  "estimand": "att",
  "treatment_type": "binary",
  "covariate_timing": "pre_treatment",
  "confounder_status": "partial",
  "overlap_status": "limited",
  "balance_status": "unknown",
  "missingness_status": "moderate",
  "sample_size": 1800,
  "n_covariates": 35,
  "survey_weights": false,
  "clustered": false,
  "needs_exact_match": true,
  "needs_interpretability": true,
  "language": "either"
}
